{
  "state_version": 1,
  "manifest_version": 2,
  "agent_id": "synthetic-gmail-meeting-assistant",
  "observed_at": "2026-07-16T09:05:00Z",
  "status": "needs_attention",
  "connections": [
    { "connection_id": "gmail", "state": "connected", "masked_account": "m••••••@example.test", "checked_at": "2026-07-16T09:00:00Z", "reauthorization_required": false },
    { "connection_id": "calendar", "state": "connected", "masked_account": "m••••••@example.test", "checked_at": "2026-07-16T09:00:00Z", "reauthorization_required": false }
  ],
  "runs": [
    { "id": "run-synthetic-20260716-01", "status": "waiting_for_approval", "started_at": "2026-07-16T09:01:00Z", "progress": 0.57, "current_step": "human_approval_gate" }
  ],
  "tasks": [
    { "id": "task-meeting-01", "run_id": "run-synthetic-20260716-01", "label": "Schedule a synthetic project review", "status": "waiting_for_approval", "created_at": "2026-07-16T09:01:20Z", "detail": "A proposed time is ready for approval" }
  ],
  "choices": [
    {
      "id": "choice-time-01",
      "task_id": "task-meeting-01",
      "label": "Choose a meeting time",
      "options": [
        { "id": "time-a", "label": "Tuesday at 10:00", "detail": "30 minutes" },
        { "id": "time-b", "label": "Wednesday at 14:30", "detail": "30 minutes" }
      ],
      "expires_at": "2026-07-17T09:00:00Z",
      "selected_option_id": "time-a"
    }
  ],
  "actions": [
    {
      "id": "action-create-invite-draft",
      "task_id": "task-meeting-01",
      "label": "Create invite and save Gmail draft",
      "command": "approve",
      "approval_required": true,
      "approval": { "enforcement": "runner_enforced", "request_id": "approval-meeting-01" }
    }
  ],
  "approval_requests": [
    {
      "id": "approval-meeting-01",
      "task_id": "task-meeting-01",
      "action_id": "action-create-invite-draft",
      "label": "Create invite and save Gmail draft",
      "status": "pending",
      "requested_at": "2026-07-16T09:04:00Z",
      "expires_at": "2026-07-17T09:00:00Z",
      "runner_enforced": true,
      "audit": { "correlation_id": "corr-meeting-01", "causation_id": "choice-time-01" }
    }
  ],
  "approval_decisions": [],
  "memory": [
    { "id": "memory-duration", "label": "Meeting duration", "summary": "Prefer 30-minute meetings", "provenance": "User approved this preference on 2026-07-10", "retention": "user_approved", "user_visible": true, "updated_at": "2026-07-10T12:00:00Z" }
  ],
  "audit_events": [
    { "id": "audit-choice-01", "type": "choice_recorded", "actor_id": "user-synthetic-01", "target_id": "choice-time-01", "ts": "2026-07-16T09:03:30Z", "detail": "Selected Tuesday at 10:00", "audit": { "correlation_id": "corr-meeting-01" } }
  ],
  "plan_vs_actual": {
    "run_id": "run-synthetic-20260716-01",
    "planned_components": ["gmail_meeting_request_read", "calendar_availability_read", "propose_two_times", "human_approval_gate", "calendar_event_create", "gmail_draft_create", "audit_log"],
    "executed_components": ["gmail_meeting_request_read", "calendar_availability_read", "propose_two_times", "human_approval_gate"],
    "deviations": []
  }
}
